{"artifact_schema_version":"portfolio_artifact.v1","calibration_hash":"cccccccccccccccccccccccccccccccccccccccccccccccccccccccccccccccc","code_version":"93e488b02086","config_hash":"9ffbffd43246ae0110db7bd6573c36a81a7915b4e55fe7d03101469b9d2890e5","counts":{"n_duplicates":0,"n_execution_inputs":1,"n_input_orders":3,"n_ledger_entries":3,"n_positions":3,"n_quality_warnings":0,"n_rejected":0,"n_warnings":0},"dataset_hash":"bbbbbbbbbbbbbbbbbbbbbbbbbbbbbbbbbbbbbbbbbbbbbbbbbbbbbbbbbbbbbbbb","decision_payload_hash":"9ffb9530d57265bb776d9d6d14d67c47d61fbd2e3ee44ccd4e86db1e7d6d0c66","decision_policy_hash":null,"forecast_payload_hash":"ffffffffffffffffffffffffffffffffffffffffffffffffffffffffffffffff","generated_at_utc":"2026-02-01T00:00:00+00:00","input_decision_run_ids":["eff7a9d4527e5f08a19b23483d411215"],"input_execution_hashes":["0645907a1368e53f5af0375e277cd3cf1d25931a1c419f17c835285822195b99"],"input_execution_run_ids":["5d0f88ea879c5ba2a1b03a1c30480e17"],"input_forecast_run_ids":["forecast-run-sample"],"input_trade_plan_run_ids":["5773412fa8cb5687b5832542b7c65ad4"],"ledger_entries":[{"client_order_id":"36912b619c6340994252d7cb9af1b553a427201fef9d9ebcf63ebedeee50c1ad","entry_id":"499dbb378121e469e5bad4fb103e7b1a2b865640949110b9a4890b1d26edb332","executed_at_utc":"2026-02-01T00:00:00+00:00","execution_artifact_hash":"0645907a1368e53f5af0375e277cd3cf1d25931a1c419f17c835285822195b99","execution_run_id":"5d0f88ea879c5ba2a1b03a1c30480e17","fee_usd":0.0,"market_id":"mkt-f","notional_usd":25.0,"price":0.45,"quantity":55.56,"side":"BUY_NO","status":"SIMULATED_FILLED","token_id":"tok-f","total_cost_usd":25.0},{"client_order_id":"46f59ff60a6f138b43c55bc2418453d786665abb56ff15a41bd3bac006b113cb","entry_id":"b38543ff2b263b15e4ea182d48fd29ec8efa675d67a215ef40f210e2ad173022","executed_at_utc":"2026-02-01T00:00:00+00:00","execution_artifact_hash":"0645907a1368e53f5af0375e277cd3cf1d25931a1c419f17c835285822195b99","execution_run_id":"5d0f88ea879c5ba2a1b03a1c30480e17","fee_usd":0.0,"market_id":"mkt-a","notional_usd":25.0,"price":0.52,"quantity":48.08,"side":"BUY_YES","status":"SIMULATED_FILLED","token_id":"tok-a","total_cost_usd":25.0},{"client_order_id":"f686ddd5be4f15126158ade66c332fc174b542d043904810cea3be52a4f1cd65","entry_id":"ac58a0edd66b9e3ef6fee9bf0a070f67472473b09856f0177d17de2d3c72d2b4","executed_at_utc":"2026-02-01T00:00:00+00:00","execution_artifact_hash":"0645907a1368e53f5af0375e277cd3cf1d25931a1c419f17c835285822195b99","execution_run_id":"5d0f88ea879c5ba2a1b03a1c30480e17","fee_usd":0.0,"market_id":"mkt-b","notional_usd":25.0,"price":0.55,"quantity":45.45,"side":"BUY_NO","status":"SIMULATED_FILLED","token_id":"tok-b","total_cost_usd":25.0}],"ledger_hash":"661dc7c2610bcbf7fa37235b560952c8d456442469e335cc577d5d807fddd689","model_hash":"9999999999999999999999999999999999999999999999999999999999999999","params":{"artifacts_root":"artifacts","fee_bps":0.0,"fee_usd":0.0,"mark_source":"execution_price","reference_prices_json":null},"portfolio_payload_hash":"75187f5aca12e478497947daa5d88e2fb5d9e41f5b5626dd6557e0f103376354","portfolio_policy_hash":"b6199eaaa45dd159696d821fa9b8c9464f42cd0cd1a108475d0877728794097e","portfolio_policy_version":"portfolio_accounting.v1","positions":[{"avg_cost":0.51996672,"cost_basis_usd":25.0,"fees_usd":0.0,"market_ids":["mkt-a"],"notional_usd":25.0,"position_id":"e61256523c121003a55c0e50192673a160748e1f25e5cf107e7ae5b8302330b8","quantity":48.08,"side":"BUY_YES","token_id":"tok-a"},{"avg_cost":0.55005501,"cost_basis_usd":25.0,"fees_usd":0.0,"market_ids":["mkt-b"],"notional_usd":25.0,"position_id":"5f6cfafd9d3d6ea0d0175cfda1bf64d5e62cb5f862701796d5967179d6c70d66","quantity":45.45,"side":"BUY_NO","token_id":"tok-b"},{"avg_cost":0.449964,"cost_basis_usd":25.0,"fees_usd":0.0,"market_ids":["mkt-f"],"notional_usd":25.0,"position_id":"23413f810274b9fd015dcb1efe6c5170c2f616751721f1141341bf31b12d1227","quantity":55.56,"side":"BUY_NO","token_id":"tok-f"}],"positions_hash":"aab70ae067c4f78dacef45b9a800c1d747d9682215dd14fba9e0c97b504eda86","quality_flags":[],"quality_warnings":[],"run_id":"38eb02ea3f37503a9809e8e044d244ca","trade_plan_payload_hash":"bfee8ab1044ef038b05cd3025015677365be45086a038281830bfb6c8e079064","uncertainty_hash":"eeeeeeeeeeeeeeeeeeeeeeeeeeeeeeeeeeeeeeeeeeeeeeeeeeeeeeeeeeeeeeee","valuation":{"mark_source":"execution_price","per_position":[{"avg_cost":0.51996672,"cost_basis_usd":25.0,"mark_price":0.52,"market_value_usd":25.0,"notional_exposure_usd":25.0,"position_id":"e61256523c121003a55c0e50192673a160748e1f25e5cf107e7ae5b8302330b8","quantity":48.08,"side":"BUY_YES","token_id":"tok-a","unrealized_pnl_usd":0.0},{"avg_cost":0.55005501,"cost_basis_usd":25.0,"mark_price":0.55,"market_value_usd":25.0,"notional_exposure_usd":25.0,"position_id":"5f6cfafd9d3d6ea0d0175cfda1bf64d5e62cb5f862701796d5967179d6c70d66","quantity":45.45,"side":"BUY_NO","token_id":"tok-b","unrealized_pnl_usd":-0.0},{"avg_cost":0.449964,"cost_basis_usd":25.0,"mark_price":0.45,"market_value_usd":25.0,"notional_exposure_usd":25.0,"position_id":"23413f810274b9fd015dcb1efe6c5170c2f616751721f1141341bf31b12d1227","quantity":55.56,"side":"BUY_NO","token_id":"tok-f","unrealized_pnl_usd":0.0}],"summary":{"n_positions":3,"total_cost_basis_usd":75.0,"total_market_value_usd":75.0,"total_notional_exposure_usd":75.0,"total_unrealized_pnl_usd":0.0}},"valuation_hash":"4adbb20db3edba6c6e8d661a0e59da118268e5a6fb956c60caf33935f6c62a8d"}