{"artifact_schema_version":"portfolio_artifact.v1","calibration_hash":"4f53cda18c2baa0c0354bb5f9a3ecbe5ed12ab4d8e11ba873c2f11161202b945","code_version":"93e488b02086","config_hash":"98e11e15e8bdfad549e7e1ebb6385fcfd550650d7351254c7bda61ec6d401199","counts":{"n_duplicates":0,"n_execution_inputs":1,"n_input_orders":0,"n_ledger_entries":0,"n_positions":0,"n_quality_warnings":0,"n_rejected":0,"n_warnings":0},"dataset_hash":"4f53cda18c2baa0c0354bb5f9a3ecbe5ed12ab4d8e11ba873c2f11161202b945","decision_payload_hash":"95efaaf00abf1b52b9c7641fb14abfdc3cc391b8f6a05946aa1313760bda0bc3","decision_policy_hash":null,"forecast_payload_hash":"4f53cda18c2baa0c0354bb5f9a3ecbe5ed12ab4d8e11ba873c2f11161202b945","generated_at_utc":"2026-02-16T06:22:13+00:00","input_decision_run_ids":["fbceffc87eb65dc3af7c9cd528b4e62b"],"input_execution_hashes":["4857b2319b50a20ba373794c233671344ebaf4efc1e6abf41d3fa8db08c14da0"],"input_execution_run_ids":["fb817b2cc36059d8b0a40cd6184952e4"],"input_forecast_run_ids":["916a36568aa957fa9695fa7efbc244c9"],"input_trade_plan_run_ids":["c99c7552207c5d2d8fd4cc79f77d828d"],"ledger_entries":[],"ledger_hash":"4f53cda18c2baa0c0354bb5f9a3ecbe5ed12ab4d8e11ba873c2f11161202b945","model_hash":"5fefc094e744f012e566c8ecad5bf2331b43068d1c65056af8d72a621d6fa7de","params":{"artifacts_root":"artifacts","fee_bps":0.0,"fee_usd":0.0,"mark_source":"execution_price","reference_prices_json":null},"portfolio_payload_hash":"da4c05cb127113de6fef2c531212a1f8aaac911c366d539642d0ce67348203be","portfolio_policy_hash":"b6199eaaa45dd159696d821fa9b8c9464f42cd0cd1a108475d0877728794097e","portfolio_policy_version":"portfolio_accounting.v1","positions":[],"positions_hash":"4f53cda18c2baa0c0354bb5f9a3ecbe5ed12ab4d8e11ba873c2f11161202b945","quality_flags":[],"quality_warnings":[],"run_id":"549b6723f82657efa8528050551c2671","trade_plan_payload_hash":"80358cdfbc88107c705eb9514070e60d234d355bbd563c25486925735ae18566","uncertainty_hash":"4f53cda18c2baa0c0354bb5f9a3ecbe5ed12ab4d8e11ba873c2f11161202b945","valuation":{"mark_source":"execution_price","per_position":[],"summary":{"n_positions":0,"total_cost_basis_usd":0.0,"total_market_value_usd":0.0,"total_notional_exposure_usd":0.0,"total_unrealized_pnl_usd":0.0}},"valuation_hash":"915be4968aa94c4bdd2e3fb927e6c2813327cf54c95e95227ace34cb2051538b"}