{
    "artifact_schema_version": "portfolio_artifact.v1",
    "run_id": "portfolio-run-sample-a",
    "generated_at_utc": "2026-02-04T00:00:00+00:00",
    "code_version": "portfolio-code-a",
    "config_hash": "aaaaaaaaaaaaaaaaaaaaaaaaaaaaaaaaaaaaaaaaaaaaaaaaaaaaaaaaaaaaaaaa",
    "input_execution_run_ids": ["execution-run-sample-a"],
    "input_execution_hashes": ["dddddddddddddddddddddddddddddddddddddddddddddddddddddddddddddddd"],
    "input_trade_plan_run_ids": ["trade-plan-run-sample-a"],
    "input_decision_run_ids": ["decision-run-sample-a"],
    "input_forecast_run_ids": ["forecast-run-sample-a"],
    "forecast_payload_hash": "ffffffffffffffffffffffffffffffffffffffffffffffffffffffffffffffff",
    "dataset_hash": "1111111111111111111111111111111111111111111111111111111111111111",
    "model_hash": "2222222222222222222222222222222222222222222222222222222222222222",
    "calibration_hash": "3333333333333333333333333333333333333333333333333333333333333333",
    "uncertainty_hash": "4444444444444444444444444444444444444444444444444444444444444444",
    "decision_payload_hash": "5555555555555555555555555555555555555555555555555555555555555555",
    "decision_policy_hash": "6666666666666666666666666666666666666666666666666666666666666666",
    "trade_plan_payload_hash": "7777777777777777777777777777777777777777777777777777777777777777",
    "portfolio_policy_version": "portfolio_accounting.v1",
    "portfolio_policy_hash": "8888888888888888888888888888888888888888888888888888888888888888",
    "params": {
        "fee_bps": 0.0,
        "fee_usd": 0.0,
        "mark_source": "execution_price",
        "reference_prices_json": null},
    "quality_flags": [],
    "quality_warnings": [
        {"code": "rejected_order", "message": "Rejected order produced no ledger entry."}
    ],
    "ledger_entries": [
        {
            "entry_id": "4590979c4ac522cef8b4188f44fb967172fd9838ed947f1c393b8546cfc8939d",
            "executed_at_utc": "2026-02-04T00:00:00+00:00",
            "execution_run_id": "execution-run-sample-a",
            "execution_artifact_hash": "dddddddddddddddddddddddddddddddddddddddddddddddddddddddddddddddd",
            "client_order_id": "1111111111111111111111111111111111111111111111111111111111111111",
            "market_id": "mkt-a",
            "token_id": "tok-a",
            "side": "BUY_YES",
            "status": "SIMULATED_FILLED",
            "quantity": 200.0,
            "price": 0.5,
            "notional_usd": 100.0,
            "fee_usd": 0.0,
            "total_cost_usd": 100.0},
        {
            "entry_id": "121d021c5e04c88df003c2b05f2af0bfb74b070fe173539f70de9b03b41b478d",
            "executed_at_utc": "2026-02-04T00:00:00+00:00",
            "execution_run_id": "execution-run-sample-a",
            "execution_artifact_hash": "dddddddddddddddddddddddddddddddddddddddddddddddddddddddddddddddd",
            "client_order_id": "2222222222222222222222222222222222222222222222222222222222222222",
            "market_id": "mkt-b",
            "token_id": "tok-b",
            "side": "BUY_NO",
            "status": "SIMULATED_FILLED",
            "quantity": 200.0,
            "price": 0.5,
            "notional_usd": 100.0,
            "fee_usd": 0.0,
            "total_cost_usd": 100.0}],
    "positions": [
        {
            "position_id": "e61256523c121003a55c0e50192673a160748e1f25e5cf107e7ae5b8302330b8",
            "token_id": "tok-a",
            "side": "BUY_YES",
            "quantity": 200.0,
            "avg_cost": 0.5,
            "cost_basis_usd": 100.0,
            "notional_usd": 100.0,
            "fees_usd": 0.0,
            "market_ids": ["mkt-a"]},
        {
            "position_id": "5f6cfafd9d3d6ea0d0175cfda1bf64d5e62cb5f862701796d5967179d6c70d66",
            "token_id": "tok-b",
            "side": "BUY_NO",
            "quantity": 200.0,
            "avg_cost": 0.5,
            "cost_basis_usd": 100.0,
            "notional_usd": 100.0,
            "fees_usd": 0.0,
            "market_ids": ["mkt-b"]}],
    "valuation": {
        "mark_source": "execution_price",
        "summary": {
            "n_positions": 2,
            "total_cost_basis_usd": 200.0,
            "total_market_value_usd": 200.0,
            "total_unrealized_pnl_usd": 0.0,
            "total_notional_exposure_usd": 200.0},
        "per_position": [
            {
                "position_id": "e61256523c121003a55c0e50192673a160748e1f25e5cf107e7ae5b8302330b8",
                "token_id": "tok-a",
                "side": "BUY_YES",
                "quantity": 200.0,
                "avg_cost": 0.5,
                "mark_price": 0.5,
                "cost_basis_usd": 100.0,
                "market_value_usd": 100.0,
                "unrealized_pnl_usd": 0.0,
                "notional_exposure_usd": 100.0,
                "category": "politics"},
            {
                "position_id": "5f6cfafd9d3d6ea0d0175cfda1bf64d5e62cb5f862701796d5967179d6c70d66",
                "token_id": "tok-b",
                "side": "BUY_NO",
                "quantity": 200.0,
                "avg_cost": 0.5,
                "mark_price": 0.5,
                "cost_basis_usd": 100.0,
                "market_value_usd": 100.0,
                "unrealized_pnl_usd": 0.0,
                "notional_exposure_usd": 100.0,
                "category": "sports"}]},
    "counts": {
        "n_execution_inputs": 1,
        "n_input_orders": 3,
        "n_ledger_entries": 2,
        "n_positions": 2,
        "n_quality_warnings": 1,
        "n_duplicates": 0},
    "ledger_hash": "9999999999999999999999999999999999999999999999999999999999999999",
    "positions_hash": "abababababababababababababababababababababababababababababababab",
    "valuation_hash": "bcbcbcbcbcbcbcbcbcbcbcbcbcbcbcbcbcbcbcbcbcbcbcbcbcbcbcbcbcbcbcbc",
    "portfolio_payload_hash": "cdcdcdcdcdcdcdcdcdcdcdcdcdcdcdcdcdcdcdcdcdcdcdcdcdcdcdcdcdcdcdcd"}
