{"artifact_schema_version":"portfolio_artifact.v1","calibration_hash":"cccccccccccccccccccccccccccccccccccccccccccccccccccccccccccccccc","code_version":"93e488b02086","config_hash":"ce979b1a56119212d77679ef6df218d5aa232ff3b94c1b79414ddb8f7f0edb82","counts":{"n_duplicates":0,"n_execution_inputs":1,"n_input_orders":3,"n_ledger_entries":3,"n_positions":3,"n_quality_warnings":0,"n_rejected":0,"n_warnings":0},"dataset_hash":"bbbbbbbbbbbbbbbbbbbbbbbbbbbbbbbbbbbbbbbbbbbbbbbbbbbbbbbbbbbbbbbb","decision_payload_hash":"752504cf68248288f764b3920c09b7bb1665886ba0938c3cb592962b0e69acc4","decision_policy_hash":null,"forecast_payload_hash":"ffffffffffffffffffffffffffffffffffffffffffffffffffffffffffffffff","generated_at_utc":"2026-02-01T00:00:00+00:00","input_decision_run_ids":["4b1f67b397d75781922dd5eabb1b5e7b"],"input_execution_hashes":["95c1657d7aa7981aa17499da9e71420d5886f9e89f042b5553db451e142e0b71"],"input_execution_run_ids":["063bfc4ee55e52a5a050a6fa749d009e"],"input_forecast_run_ids":["forecast-run-sample"],"input_trade_plan_run_ids":["99587b8cecbf59818561c19beb403a90"],"ledger_entries":[{"client_order_id":"19a610a47b3485d0777ea9e76fa2a80303502ef0a68fee839c772f441e1abbbf","entry_id":"a45e818f4a7ec5531ee0111780c3f84c20fe59300b1957fdf9d4669d0e8c588a","executed_at_utc":"2026-02-01T00:00:00+00:00","execution_artifact_hash":"95c1657d7aa7981aa17499da9e71420d5886f9e89f042b5553db451e142e0b71","execution_run_id":"063bfc4ee55e52a5a050a6fa749d009e","fee_usd":0.0,"market_id":"mkt-a","notional_usd":25.0,"price":0.52,"quantity":48.08,"side":"BUY_YES","status":"SIMULATED_FILLED","token_id":"tok-a","total_cost_usd":25.0},{"client_order_id":"4fd5bf0ace0136e6579c9806ee39790a8988e2490570e326a540120880642abe","entry_id":"d44a671b48ad037d54e3c1c0f5863a466a65f55d5477c4cd68c2f3085ebd639b","executed_at_utc":"2026-02-01T00:00:00+00:00","execution_artifact_hash":"95c1657d7aa7981aa17499da9e71420d5886f9e89f042b5553db451e142e0b71","execution_run_id":"063bfc4ee55e52a5a050a6fa749d009e","fee_usd":0.0,"market_id":"mkt-f","notional_usd":25.0,"price":0.45,"quantity":55.56,"side":"BUY_NO","status":"SIMULATED_FILLED","token_id":"tok-f","total_cost_usd":25.0},{"client_order_id":"a051f7be07adb89989c588338155e1b295c9893af91f21458e9980b4bcf899d7","entry_id":"f51fca0ba8b63385667dad450d8d183dbfb7514a3a25d4ae408a21ddfd0c732e","executed_at_utc":"2026-02-01T00:00:00+00:00","execution_artifact_hash":"95c1657d7aa7981aa17499da9e71420d5886f9e89f042b5553db451e142e0b71","execution_run_id":"063bfc4ee55e52a5a050a6fa749d009e","fee_usd":0.0,"market_id":"mkt-b","notional_usd":25.0,"price":0.55,"quantity":45.45,"side":"BUY_NO","status":"SIMULATED_FILLED","token_id":"tok-b","total_cost_usd":25.0}],"ledger_hash":"317d11cd6c1b9140d9ff71063823c78f715b8776e5e43258adc4896bccfe83ee","model_hash":"9999999999999999999999999999999999999999999999999999999999999999","params":{"artifacts_root":"artifacts","fee_bps":0.0,"fee_usd":0.0,"mark_source":"execution_price","reference_prices_json":null},"portfolio_payload_hash":"d6e662f1fe07951a772e0a8d1ab17771d2de08bd19f650724a6784c96497d790","portfolio_policy_hash":"b6199eaaa45dd159696d821fa9b8c9464f42cd0cd1a108475d0877728794097e","portfolio_policy_version":"portfolio_accounting.v1","positions":[{"avg_cost":0.51996672,"cost_basis_usd":25.0,"fees_usd":0.0,"market_ids":["mkt-a"],"notional_usd":25.0,"position_id":"e61256523c121003a55c0e50192673a160748e1f25e5cf107e7ae5b8302330b8","quantity":48.08,"side":"BUY_YES","token_id":"tok-a"},{"avg_cost":0.55005501,"cost_basis_usd":25.0,"fees_usd":0.0,"market_ids":["mkt-b"],"notional_usd":25.0,"position_id":"5f6cfafd9d3d6ea0d0175cfda1bf64d5e62cb5f862701796d5967179d6c70d66","quantity":45.45,"side":"BUY_NO","token_id":"tok-b"},{"avg_cost":0.449964,"cost_basis_usd":25.0,"fees_usd":0.0,"market_ids":["mkt-f"],"notional_usd":25.0,"position_id":"23413f810274b9fd015dcb1efe6c5170c2f616751721f1141341bf31b12d1227","quantity":55.56,"side":"BUY_NO","token_id":"tok-f"}],"positions_hash":"aab70ae067c4f78dacef45b9a800c1d747d9682215dd14fba9e0c97b504eda86","quality_flags":[],"quality_warnings":[],"run_id":"bedfba2589365787b95cda410553e381","trade_plan_payload_hash":"de4b0ed51cfb9abe0fd8c92cde2cb9d4824c9aacd916af669c83f1bf84c51af9","uncertainty_hash":"eeeeeeeeeeeeeeeeeeeeeeeeeeeeeeeeeeeeeeeeeeeeeeeeeeeeeeeeeeeeeeee","valuation":{"mark_source":"execution_price","per_position":[{"avg_cost":0.51996672,"cost_basis_usd":25.0,"mark_price":0.52,"market_value_usd":25.0,"notional_exposure_usd":25.0,"position_id":"e61256523c121003a55c0e50192673a160748e1f25e5cf107e7ae5b8302330b8","quantity":48.08,"side":"BUY_YES","token_id":"tok-a","unrealized_pnl_usd":0.0},{"avg_cost":0.55005501,"cost_basis_usd":25.0,"mark_price":0.55,"market_value_usd":25.0,"notional_exposure_usd":25.0,"position_id":"5f6cfafd9d3d6ea0d0175cfda1bf64d5e62cb5f862701796d5967179d6c70d66","quantity":45.45,"side":"BUY_NO","token_id":"tok-b","unrealized_pnl_usd":-0.0},{"avg_cost":0.449964,"cost_basis_usd":25.0,"mark_price":0.45,"market_value_usd":25.0,"notional_exposure_usd":25.0,"position_id":"23413f810274b9fd015dcb1efe6c5170c2f616751721f1141341bf31b12d1227","quantity":55.56,"side":"BUY_NO","token_id":"tok-f","unrealized_pnl_usd":0.0}],"summary":{"n_positions":3,"total_cost_basis_usd":75.0,"total_market_value_usd":75.0,"total_notional_exposure_usd":75.0,"total_unrealized_pnl_usd":0.0}},"valuation_hash":"4adbb20db3edba6c6e8d661a0e59da118268e5a6fb956c60caf33935f6c62a8d"}