{"artifact_schema_version":"portfolio_artifact.v1","calibration_hash":"4f53cda18c2baa0c0354bb5f9a3ecbe5ed12ab4d8e11ba873c2f11161202b945","code_version":"93e488b02086","config_hash":"cb7baaa58864042e3d735560e45d3b13a999c938de7c95131cda9594f53624f0","counts":{"n_duplicates":0,"n_execution_inputs":1,"n_input_orders":0,"n_ledger_entries":0,"n_positions":0,"n_quality_warnings":0,"n_rejected":0,"n_warnings":0},"dataset_hash":"4f53cda18c2baa0c0354bb5f9a3ecbe5ed12ab4d8e11ba873c2f11161202b945","decision_payload_hash":"fd91cc39434a0e38c20e8d5640bb1a233df2bd9f67d96a653c480265a01c6ec9","decision_policy_hash":null,"forecast_payload_hash":"4f53cda18c2baa0c0354bb5f9a3ecbe5ed12ab4d8e11ba873c2f11161202b945","generated_at_utc":"2026-02-16T06:22:13+00:00","input_decision_run_ids":["a007d1a8cdfb5786a347c07025f77b3d"],"input_execution_hashes":["852e00b96c61c71933842a175de46184fbef595e447aa9c7ced77a8cd3871e99"],"input_execution_run_ids":["e8ec14b3f652540b90d89787f83d8ced"],"input_forecast_run_ids":["916a36568aa957fa9695fa7efbc244c9"],"input_trade_plan_run_ids":["99c96ea5a48956808365543981fdd3bd"],"ledger_entries":[],"ledger_hash":"4f53cda18c2baa0c0354bb5f9a3ecbe5ed12ab4d8e11ba873c2f11161202b945","model_hash":"5fefc094e744f012e566c8ecad5bf2331b43068d1c65056af8d72a621d6fa7de","params":{"artifacts_root":"artifacts","fee_bps":0.0,"fee_usd":0.0,"mark_source":"execution_price","reference_prices_json":null},"portfolio_payload_hash":"35245b1fb5feb026dfdfc2e6e2946a5010f8b0d85f5e98bf49f2c2d7353f1126","portfolio_policy_hash":"b6199eaaa45dd159696d821fa9b8c9464f42cd0cd1a108475d0877728794097e","portfolio_policy_version":"portfolio_accounting.v1","positions":[],"positions_hash":"4f53cda18c2baa0c0354bb5f9a3ecbe5ed12ab4d8e11ba873c2f11161202b945","quality_flags":[],"quality_warnings":[],"run_id":"d905a7bcd0b75ba690f585276b979bf3","trade_plan_payload_hash":"c0b69bd09729bf2136a02d9c7ded8679228ca9a100252e9bea175bbaa28753c2","uncertainty_hash":"4f53cda18c2baa0c0354bb5f9a3ecbe5ed12ab4d8e11ba873c2f11161202b945","valuation":{"mark_source":"execution_price","per_position":[],"summary":{"n_positions":0,"total_cost_basis_usd":0.0,"total_market_value_usd":0.0,"total_notional_exposure_usd":0.0,"total_unrealized_pnl_usd":0.0}},"valuation_hash":"915be4968aa94c4bdd2e3fb927e6c2813327cf54c95e95227ace34cb2051538b"}