{"artifact_schema_version":"portfolio_artifact.v1","calibration_hash":"4f53cda18c2baa0c0354bb5f9a3ecbe5ed12ab4d8e11ba873c2f11161202b945","code_version":"93e488b02086","config_hash":"cc61eaaae71963dfe2d78c3ac6fd64ddc8190f3a3ddddc2ce60ae3432457f36c","counts":{"n_duplicates":0,"n_execution_inputs":1,"n_input_orders":0,"n_ledger_entries":0,"n_positions":0,"n_quality_warnings":0,"n_rejected":0,"n_warnings":0},"dataset_hash":"4f53cda18c2baa0c0354bb5f9a3ecbe5ed12ab4d8e11ba873c2f11161202b945","decision_payload_hash":"2b86d00e3cc2941454d6065b4e265272a174f9037f1334b15c7fed82763cdfa9","decision_policy_hash":null,"forecast_payload_hash":"4f53cda18c2baa0c0354bb5f9a3ecbe5ed12ab4d8e11ba873c2f11161202b945","generated_at_utc":"2026-02-16T06:22:13+00:00","input_decision_run_ids":["3e91568526875452b154bcbbff3e232d"],"input_execution_hashes":["39a10bf23933756a6fd48bfe9cd74a7d45a2cdc63f66fc91fbbde5410f7a6f2a"],"input_execution_run_ids":["564486a746ab5960ba0287c8c8c319f4"],"input_forecast_run_ids":["916a36568aa957fa9695fa7efbc244c9"],"input_trade_plan_run_ids":["4dd16d5b7dec55d180b7c05b53c949f8"],"ledger_entries":[],"ledger_hash":"4f53cda18c2baa0c0354bb5f9a3ecbe5ed12ab4d8e11ba873c2f11161202b945","model_hash":"5fefc094e744f012e566c8ecad5bf2331b43068d1c65056af8d72a621d6fa7de","params":{"artifacts_root":"artifacts","fee_bps":0.0,"fee_usd":0.0,"mark_source":"execution_price","reference_prices_json":null},"portfolio_payload_hash":"f617a0d5d4312ebef6e83b61f339a30b524795f3bc5397ba5b2a8b477d812b8f","portfolio_policy_hash":"b6199eaaa45dd159696d821fa9b8c9464f42cd0cd1a108475d0877728794097e","portfolio_policy_version":"portfolio_accounting.v1","positions":[],"positions_hash":"4f53cda18c2baa0c0354bb5f9a3ecbe5ed12ab4d8e11ba873c2f11161202b945","quality_flags":[],"quality_warnings":[],"run_id":"500b1f18999652f7a341450d49242e59","trade_plan_payload_hash":"421b19ba7baf72161456164a0d5985767339ccc2e1f534819f7e4d44f3e23c25","uncertainty_hash":"4f53cda18c2baa0c0354bb5f9a3ecbe5ed12ab4d8e11ba873c2f11161202b945","valuation":{"mark_source":"execution_price","per_position":[],"summary":{"n_positions":0,"total_cost_basis_usd":0.0,"total_market_value_usd":0.0,"total_notional_exposure_usd":0.0,"total_unrealized_pnl_usd":0.0}},"valuation_hash":"915be4968aa94c4bdd2e3fb927e6c2813327cf54c95e95227ace34cb2051538b"}