{
    "artifact_schema_version": "portfolio_artifact.v1",
    "run_id": "portfolio-run-sample-b",
    "generated_at_utc": "2026-02-05T00:00:00+00:00",
    "code_version": "portfolio-code-b",
    "config_hash": "bbbbbbbbbbbbbbbbbbbbbbbbbbbbbbbbbbbbbbbbbbbbbbbbbbbbbbbbbbbbbbbb",
    "input_execution_run_ids": ["execution-run-sample-b"],
    "input_execution_hashes": ["edededededededededededededededededededededededededededededededed"],
    "input_trade_plan_run_ids": ["trade-plan-run-sample-b"],
    "input_decision_run_ids": ["decision-run-sample-b"],
    "input_forecast_run_ids": ["forecast-run-sample-b"],
    "forecast_payload_hash": "efefefefefefefefefefefefefefefefefefefefefefefefefefefefefefefef",
    "dataset_hash": "1111111111111111111111111111111111111111111111111111111111111111",
    "model_hash": "2222222222222222222222222222222222222222222222222222222222222222",
    "calibration_hash": "3333333333333333333333333333333333333333333333333333333333333333",
    "uncertainty_hash": "4444444444444444444444444444444444444444444444444444444444444444",
    "decision_payload_hash": "5555555555555555555555555555555555555555555555555555555555555555",
    "decision_policy_hash": "6666666666666666666666666666666666666666666666666666666666666666",
    "trade_plan_payload_hash": "7777777777777777777777777777777777777777777777777777777777777777",
    "portfolio_policy_version": "portfolio_accounting.v1",
    "portfolio_policy_hash": "8989898989898989898989898989898989898989898989898989898989898989",
    "params": {
        "fee_bps": 0.0,
        "fee_usd": 0.0,
        "mark_source": "execution_price",
        "reference_prices_json": null},
    "quality_flags": ["duplicate_client_order_id"],
    "quality_warnings": [
        {
            "code": "duplicate_client_order_id",
            "message": "Duplicate client_order_id ignored for ledger accounting."}
    ],
    "ledger_entries": [
        {
            "entry_id": "aaaaaaaaaaaaaaaaaaaaaaaaaaaaaaaaaaaaaaaaaaaaaaaaaaaaaaaaaaaaaaaa",
            "executed_at_utc": "2026-02-05T00:00:00+00:00",
            "execution_run_id": "execution-run-sample-b",
            "execution_artifact_hash": "edededededededededededededededededededededededededededededededed",
            "client_order_id": "1010101010101010101010101010101010101010101010101010101010101010",
            "market_id": "mkt-x",
            "token_id": "tok-x",
            "side": "BUY_YES",
            "status": "SIMULATED_FILLED",
            "quantity": 1000.0,
            "price": 0.9,
            "notional_usd": 900.0,
            "fee_usd": 0.0,
            "total_cost_usd": 1080.0},
        {
            "entry_id": "bbbbbbbbbbbbbbbbbbbbbbbbbbbbbbbbbbbbbbbbbbbbbbbbbbbbbbbbbbbbbbbb",
            "executed_at_utc": "2026-02-05T00:00:00+00:00",
            "execution_run_id": "execution-run-sample-b",
            "execution_artifact_hash": "edededededededededededededededededededededededededededededededed",
            "client_order_id": "2020202020202020202020202020202020202020202020202020202020202020",
            "market_id": "mkt-y",
            "token_id": "tok-y",
            "side": "BUY_NO",
            "status": "SIMULATED_FILLED",
            "quantity": 100.0,
            "price": 0.5,
            "notional_usd": 50.0,
            "fee_usd": 0.0,
            "total_cost_usd": 50.0},
        {
            "entry_id": "cccccccccccccccccccccccccccccccccccccccccccccccccccccccccccccccc",
            "executed_at_utc": "2026-02-05T00:00:00+00:00",
            "execution_run_id": "execution-run-sample-b",
            "execution_artifact_hash": "edededededededededededededededededededededededededededededededed",
            "client_order_id": "3030303030303030303030303030303030303030303030303030303030303030",
            "market_id": "mkt-z",
            "token_id": "tok-z",
            "side": "BUY_YES",
            "status": "SIMULATED_FILLED",
            "quantity": 100.0,
            "price": 0.5,
            "notional_usd": 50.0,
            "fee_usd": 0.0,
            "total_cost_usd": 50.0}],
    "positions": [
        {
            "position_id": "dddddddddddddddddddddddddddddddddddddddddddddddddddddddddddddddd",
            "token_id": "tok-x",
            "side": "BUY_YES",
            "quantity": 1000.0,
            "avg_cost": 1.08,
            "cost_basis_usd": 1080.0,
            "notional_usd": 900.0,
            "fees_usd": 0.0,
            "market_ids": ["mkt-x"]},
        {
            "position_id": "eeeeeeeeeeeeeeeeeeeeeeeeeeeeeeeeeeeeeeeeeeeeeeeeeeeeeeeeeeeeeeee",
            "token_id": "tok-y",
            "side": "BUY_NO",
            "quantity": 100.0,
            "avg_cost": 0.5,
            "cost_basis_usd": 50.0,
            "notional_usd": 50.0,
            "fees_usd": 0.0,
            "market_ids": ["mkt-y"]},
        {
            "position_id": "f0f0f0f0f0f0f0f0f0f0f0f0f0f0f0f0f0f0f0f0f0f0f0f0f0f0f0f0f0f0f0f0",
            "token_id": "tok-z",
            "side": "BUY_YES",
            "quantity": 100.0,
            "avg_cost": 0.5,
            "cost_basis_usd": 50.0,
            "notional_usd": 50.0,
            "fees_usd": 0.0,
            "market_ids": ["mkt-z"]}],
    "valuation": {
        "mark_source": "execution_price",
        "summary": {
            "n_positions": 3,
            "total_cost_basis_usd": 1180.0,
            "total_market_value_usd": 1000.0,
            "total_unrealized_pnl_usd": -180.0,
            "total_notional_exposure_usd": 1000.0},
        "per_position": [
            {
                "position_id": "dddddddddddddddddddddddddddddddddddddddddddddddddddddddddddddddd",
                "token_id": "tok-x",
                "side": "BUY_YES",
                "quantity": 1000.0,
                "avg_cost": 1.08,
                "mark_price": 0.9,
                "cost_basis_usd": 1080.0,
                "market_value_usd": 900.0,
                "unrealized_pnl_usd": -180.0,
                "notional_exposure_usd": 900.0,
                "category": "politics"},
            {
                "position_id": "eeeeeeeeeeeeeeeeeeeeeeeeeeeeeeeeeeeeeeeeeeeeeeeeeeeeeeeeeeeeeeee",
                "token_id": "tok-y",
                "side": "BUY_NO",
                "quantity": 100.0,
                "avg_cost": 0.5,
                "mark_price": 0.5,
                "cost_basis_usd": 50.0,
                "market_value_usd": 50.0,
                "unrealized_pnl_usd": 0.0,
                "notional_exposure_usd": 50.0,
                "category": "finance"},
            {
                "position_id": "f0f0f0f0f0f0f0f0f0f0f0f0f0f0f0f0f0f0f0f0f0f0f0f0f0f0f0f0f0f0f0f0",
                "token_id": "tok-z",
                "side": "BUY_YES",
                "quantity": 100.0,
                "avg_cost": 0.5,
                "mark_price": 0.5,
                "cost_basis_usd": 50.0,
                "market_value_usd": 50.0,
                "unrealized_pnl_usd": 0.0,
                "notional_exposure_usd": 50.0,
                "category": "finance"}]},
    "counts": {
        "n_execution_inputs": 1,
        "n_input_orders": 5,
        "n_ledger_entries": 3,
        "n_positions": 3,
        "n_quality_warnings": 1,
        "n_duplicates": 2},
    "ledger_hash": "9090909090909090909090909090909090909090909090909090909090909090",
    "positions_hash": "9191919191919191919191919191919191919191919191919191919191919191",
    "valuation_hash": "9292929292929292929292929292929292929292929292929292929292929292",
    "portfolio_payload_hash": "9393939393939393939393939393939393939393939393939393939393939393"}
