{"artifact_schema_version":"portfolio_artifact.v1","calibration_hash":"cccccccccccccccccccccccccccccccccccccccccccccccccccccccccccccccc","code_version":"93e488b02086","config_hash":"20ba57d358b77ef41baaaedd911dde5626fcedb054208ad136a547f08e008799","counts":{"n_duplicates":0,"n_execution_inputs":1,"n_input_orders":3,"n_ledger_entries":3,"n_positions":3,"n_quality_warnings":0,"n_rejected":0,"n_warnings":0},"dataset_hash":"bbbbbbbbbbbbbbbbbbbbbbbbbbbbbbbbbbbbbbbbbbbbbbbbbbbbbbbbbbbbbbbb","decision_payload_hash":"491ab75101fda028430cf92023c41f34786fc3b6bb74b4cd8e4efb854644c831","decision_policy_hash":null,"forecast_payload_hash":"ffffffffffffffffffffffffffffffffffffffffffffffffffffffffffffffff","generated_at_utc":"2026-02-01T00:00:00+00:00","input_decision_run_ids":["5caa8583201f5980873a15394692519a"],"input_execution_hashes":["105179ca594a1bc1d5232033e32733981cdd122174ef5c87e86a553f65fc9f28"],"input_execution_run_ids":["185e739121885a998fc39eb17bf6efee"],"input_forecast_run_ids":["forecast-run-sample"],"input_trade_plan_run_ids":["8e7da4a9d9f15eba81539f677975749e"],"ledger_entries":[{"client_order_id":"26491f260f7e0a743b008a250fc77b3fe02f079e1f4da36998c69c8d4b04a677","entry_id":"93668f3f540a755f8f43352bd670b8810cac2f98826abe77dd7f7687a6f69041","executed_at_utc":"2026-02-01T00:00:00+00:00","execution_artifact_hash":"105179ca594a1bc1d5232033e32733981cdd122174ef5c87e86a553f65fc9f28","execution_run_id":"185e739121885a998fc39eb17bf6efee","fee_usd":0.0,"market_id":"mkt-a","notional_usd":25.0,"price":0.52,"quantity":48.08,"side":"BUY_YES","status":"SIMULATED_FILLED","token_id":"tok-a","total_cost_usd":25.0},{"client_order_id":"bda359d842d08b0e3afd1f15727d22d72bdce1a18ffa8d195d97ec9685d81d40","entry_id":"2f8222bb6029b69ff671e02579d0e03153406171b33a1879b587ddc9ca5054bd","executed_at_utc":"2026-02-01T00:00:00+00:00","execution_artifact_hash":"105179ca594a1bc1d5232033e32733981cdd122174ef5c87e86a553f65fc9f28","execution_run_id":"185e739121885a998fc39eb17bf6efee","fee_usd":0.0,"market_id":"mkt-f","notional_usd":25.0,"price":0.45,"quantity":55.56,"side":"BUY_NO","status":"SIMULATED_FILLED","token_id":"tok-f","total_cost_usd":25.0},{"client_order_id":"f8d7c7b13ed2271eb28d0757c0e1bf484b6a7af227daf1badac09d942de6f36f","entry_id":"3d18de0f2f0cce534873f0aaa4702bb12137c18c6d7b317862e3eb0ad6966e27","executed_at_utc":"2026-02-01T00:00:00+00:00","execution_artifact_hash":"105179ca594a1bc1d5232033e32733981cdd122174ef5c87e86a553f65fc9f28","execution_run_id":"185e739121885a998fc39eb17bf6efee","fee_usd":0.0,"market_id":"mkt-b","notional_usd":25.0,"price":0.55,"quantity":45.45,"side":"BUY_NO","status":"SIMULATED_FILLED","token_id":"tok-b","total_cost_usd":25.0}],"ledger_hash":"c25f91ea12eff8fd28e50409dd37382aa7ce42ab38a9061b9d97150667f485b2","model_hash":"9999999999999999999999999999999999999999999999999999999999999999","params":{"artifacts_root":"artifacts","fee_bps":0.0,"fee_usd":0.0,"mark_source":"execution_price","reference_prices_json":null},"portfolio_payload_hash":"7c48d1a2633e376bd002b22c6e412f3e006735c773d217a5a5074665df38b719","portfolio_policy_hash":"b6199eaaa45dd159696d821fa9b8c9464f42cd0cd1a108475d0877728794097e","portfolio_policy_version":"portfolio_accounting.v1","positions":[{"avg_cost":0.51996672,"cost_basis_usd":25.0,"fees_usd":0.0,"market_ids":["mkt-a"],"notional_usd":25.0,"position_id":"e61256523c121003a55c0e50192673a160748e1f25e5cf107e7ae5b8302330b8","quantity":48.08,"side":"BUY_YES","token_id":"tok-a"},{"avg_cost":0.55005501,"cost_basis_usd":25.0,"fees_usd":0.0,"market_ids":["mkt-b"],"notional_usd":25.0,"position_id":"5f6cfafd9d3d6ea0d0175cfda1bf64d5e62cb5f862701796d5967179d6c70d66","quantity":45.45,"side":"BUY_NO","token_id":"tok-b"},{"avg_cost":0.449964,"cost_basis_usd":25.0,"fees_usd":0.0,"market_ids":["mkt-f"],"notional_usd":25.0,"position_id":"23413f810274b9fd015dcb1efe6c5170c2f616751721f1141341bf31b12d1227","quantity":55.56,"side":"BUY_NO","token_id":"tok-f"}],"positions_hash":"aab70ae067c4f78dacef45b9a800c1d747d9682215dd14fba9e0c97b504eda86","quality_flags":[],"quality_warnings":[],"run_id":"6ce68484b3505454998719857f47b4f2","trade_plan_payload_hash":"3d974a9e5a6abf98a495442e7432547691d9026c6f7906540f92b39d08d1956a","uncertainty_hash":"eeeeeeeeeeeeeeeeeeeeeeeeeeeeeeeeeeeeeeeeeeeeeeeeeeeeeeeeeeeeeeee","valuation":{"mark_source":"execution_price","per_position":[{"avg_cost":0.51996672,"cost_basis_usd":25.0,"mark_price":0.52,"market_value_usd":25.0,"notional_exposure_usd":25.0,"position_id":"e61256523c121003a55c0e50192673a160748e1f25e5cf107e7ae5b8302330b8","quantity":48.08,"side":"BUY_YES","token_id":"tok-a","unrealized_pnl_usd":0.0},{"avg_cost":0.55005501,"cost_basis_usd":25.0,"mark_price":0.55,"market_value_usd":25.0,"notional_exposure_usd":25.0,"position_id":"5f6cfafd9d3d6ea0d0175cfda1bf64d5e62cb5f862701796d5967179d6c70d66","quantity":45.45,"side":"BUY_NO","token_id":"tok-b","unrealized_pnl_usd":-0.0},{"avg_cost":0.449964,"cost_basis_usd":25.0,"mark_price":0.45,"market_value_usd":25.0,"notional_exposure_usd":25.0,"position_id":"23413f810274b9fd015dcb1efe6c5170c2f616751721f1141341bf31b12d1227","quantity":55.56,"side":"BUY_NO","token_id":"tok-f","unrealized_pnl_usd":0.0}],"summary":{"n_positions":3,"total_cost_basis_usd":75.0,"total_market_value_usd":75.0,"total_notional_exposure_usd":75.0,"total_unrealized_pnl_usd":0.0}},"valuation_hash":"4adbb20db3edba6c6e8d661a0e59da118268e5a6fb956c60caf33935f6c62a8d"}