{"artifact_schema_version":"portfolio_artifact.v1","calibration_hash":"4f53cda18c2baa0c0354bb5f9a3ecbe5ed12ab4d8e11ba873c2f11161202b945","code_version":"93e488b02086","config_hash":"d78fe19ca2d8c88a96825fb35d35b34c588f35846eab0912c140d57186d0fa81","counts":{"n_duplicates":0,"n_execution_inputs":1,"n_input_orders":0,"n_ledger_entries":0,"n_positions":0,"n_quality_warnings":0,"n_rejected":0,"n_warnings":0},"dataset_hash":"4f53cda18c2baa0c0354bb5f9a3ecbe5ed12ab4d8e11ba873c2f11161202b945","decision_payload_hash":"da4b96b3b10807cb8eba7076c4fafe4d459a784e0b9175b937a2c73b485c0dfc","decision_policy_hash":null,"forecast_payload_hash":"4f53cda18c2baa0c0354bb5f9a3ecbe5ed12ab4d8e11ba873c2f11161202b945","generated_at_utc":"2026-03-10T00:00:00+00:00","input_decision_run_ids":["255b7d38448c54f38811dec253bef195"],"input_execution_hashes":["7c48486511804d057e0aa10f3a1e9e0c2be4817d3fbbb709361c0fc3042dc629"],"input_execution_run_ids":["9cf834bc3f7c5103bde23c946be43b97"],"input_forecast_run_ids":["239d1cd6e6db5370a62663353ea4ded4"],"input_trade_plan_run_ids":["bd362872ede5592c9f0ed74664867077"],"ledger_entries":[],"ledger_hash":"4f53cda18c2baa0c0354bb5f9a3ecbe5ed12ab4d8e11ba873c2f11161202b945","model_hash":"5fefc094e744f012e566c8ecad5bf2331b43068d1c65056af8d72a621d6fa7de","params":{"artifacts_root":"artifacts","fee_bps":0.0,"fee_usd":0.0,"mark_source":"execution_price","reference_prices_json":null},"portfolio_payload_hash":"57a8ecac6bd1647d77308dde272092731f977f9edb845826713f1bacdcbbe803","portfolio_policy_hash":"b6199eaaa45dd159696d821fa9b8c9464f42cd0cd1a108475d0877728794097e","portfolio_policy_version":"portfolio_accounting.v1","positions":[],"positions_hash":"4f53cda18c2baa0c0354bb5f9a3ecbe5ed12ab4d8e11ba873c2f11161202b945","quality_flags":[],"quality_warnings":[],"run_id":"6f42763de453501d9bb460ca9b008cd9","trade_plan_payload_hash":"34e0c3a8826c29047c92191be8fbb557f09387afeff135ed1ee14c533a988859","uncertainty_hash":"4f53cda18c2baa0c0354bb5f9a3ecbe5ed12ab4d8e11ba873c2f11161202b945","valuation":{"mark_source":"execution_price","per_position":[],"summary":{"n_positions":0,"total_cost_basis_usd":0.0,"total_market_value_usd":0.0,"total_notional_exposure_usd":0.0,"total_unrealized_pnl_usd":0.0}},"valuation_hash":"915be4968aa94c4bdd2e3fb927e6c2813327cf54c95e95227ace34cb2051538b"}